{
  "id": "diwali-2026-regional",
  "status": "approved",
  "kind": "event",
  "context": {
    "en": "Diwali, the festival of lights, 8 November 2026"
  },
  "when": {
    "from": "2026-10-30",
    "to": "2026-11-11"
  },
  "regions": [
    "IN",
    "NP",
    "LK",
    "SG",
    "MY",
    "MU",
    "FJ",
    "TT",
    "GY",
    "SR"
  ],
  "locales": [
    "en"
  ],
  "triggers": {
    "en": [
      "diwali",
      "happy diwali",
      "deepavali",
      "deepawali",
      "festival of lights"
    ]
  },
  "emoji": [
    {
      "hexcode": "1FA94",
      "weight": 0.9
    },
    {
      "hexcode": "1F386",
      "weight": 0.65
    },
    {
      "hexcode": "1FAB7",
      "weight": 0.5
    },
    {
      "hexcode": "1F387",
      "weight": 0.45
    }
  ],
  "featured": true,
  "source": "calendar",
  "createdBy": "ai:claude",
  "reviewedBy": "ai:claude-self-check",
  "createdAt": "2026-10-02"
}
