{
  "id": "reyes-magos",
  "status": "approved",
  "kind": "seasonal",
  "context": {
    "en": "Three Kings' Day, 6 January",
    "es": "Día de Reyes, 6 de enero"
  },
  "when": {
    "from": "12-27",
    "to": "01-06",
    "recurs": "yearly"
  },
  "regions": [
    "*"
  ],
  "locales": [
    "es"
  ],
  "triggers": {
    "es": [
      "reyes magos",
      "dia de reyes",
      "los reyes",
      "rosca de reyes",
      "roscon de reyes",
      "roscon"
    ]
  },
  "emoji": [
    {
      "hexcode": "1F451",
      "weight": 0.8
    },
    {
      "hexcode": "1F42A",
      "weight": 0.65
    },
    {
      "hexcode": "1F381",
      "weight": 0.6
    },
    {
      "hexcode": "1F31F",
      "weight": 0.4
    }
  ],
  "featured": true,
  "source": "calendar",
  "createdBy": "ai:claude",
  "reviewedBy": "ai:claude-self-check",
  "createdAt": "2026-10-02"
}
